"","id","headline","text","type"
"57","82.txt","WikiLeaks  Obama Racist Recruiting  No White, Christian Americans Need Apply","Back when Hussein Obama first befouled the White House, many naive Americans still gave him the benefit of the doubt in both his honesty and his declaration that he was a Christian. Hes since been revealed as a pathological liar and as a racist white-hating Muslim agitator, but he was operating under a much more stealthy strategy which was moderately effective at masking his destructive goals at the time. WikiLeaks has since made some things much clearer.

There were those who knew what he was up to, but their silence had been purchased. One such individual was Preeta Bansal, who may or may not share Obamas personal characteristics and goals but certainly did nothing to expose his. She was one of the first of innumerable foreigners to be given high positions within the Obama regime, being a naturalized Indian. Obama has frequently used those with the weakest of ties to traditional America as his agents of fundamental transformation and anti-white, anti-American prejudice.

673-bansal-obama-discrimination

As the WikiLeaks leaked Podesta email reveals, Bansal was engaged not only in racist employment discrimination, but religious discrimination against Christians in the recommendation and review process for potential new hires within the executive branch. Thats the kind of thing that Loretta Lynch and her bulldog DOJ Civil Rights Deputy Vanita Gupta would be all over if it were to happen to a Muslim or non-white. Discriminating against whites and Christians is just who we are under this racist America-hating Islamist.

One thing that is important to remember is that this compilation of Muslim and Asian candidates for preferential employment treatment would not have been prepared without it being specifically requested by the inner circle within the Obama administration. Race-based preference was to be given and discrimination against those who were not Muslim or Asian was to be engaged in. Being Arab alone wasnt enough to get you onto the good list. Bansal specifically states that Arab Americans who were not Muslims were not included.

She also acknowledges that she included high profile Muslims even though she believed they would not survive the vetting process due to the attention they would receive from bloggers. Two questions rise from that admission; what kind of people is she seeking that blogger revelations would sink their candidacy and why did she, knowing their background difficulties, still include them as potential recruits?

The WikiLeaks Podesta email from October of 2008, forwarded to John Podesta, which contains the Bansal correspondence is linked here and below:

Fwd: FW: Asian American Candidates, Muslim American Candidates

 

From:gaylesmithgayle@gmail.com

To: john.podesta@gmail.com

Date: 2008-10-17 08:18

Subject: Fwd: FW: Asian American Candidates, Muslim American Candidates

Lists from Preeta attached. I took Mansour Ijaz off the list, way bad idea,

can explain if needed. G

- Forwarded message -

From: Bansal, Preeta D <PBANSAL@skadden.com>

Date: Mon, Sep 29, 2008 at 11:01 PM

Subject: FW: Asian American Candidates, Muslim American Candidates

To: John Podesta <jpodesta@americanprogress.org>, Gayle Smith <

gaylesmithgayle@gmail.com>

 

FYI also.

 

________________________________

 

From: Bansal, Preeta D (NYC)

Sent: Monday, September 29, 2008 11:01 PM

To: Froman, Michael B

Cc: Onek, Matthew

Subject: Asian American Candidates, Muslim American Candidates

 

Here are the compiled lists of Asian American and Muslim American

candidates for top Administration jobs, sub-cabinet jobs, and outside

boards/agencies/policy committees. A couple things to note about the list

of Muslim American candidates:

 

1) In the candidates for top jobs, I excluded those with some Arab

American background but who are not Muslim (e.g., George Mitchell). Many

Lebanese Americans, for example, are Christian. In the last list (of

outside boards/commissions), most who are listed appear to be Muslim

American, except that a handful (where noted) may be Arab American but of

uncertain religion (esp. Christian).

 

2) There is only one candidate I thought was a viable one for a

Secretary-level job among the Muslim Americans. That said, on both lists,

there are some very senior people listed in the last category (for outside

boards/commissions) who conceivably could be considered for top jobs. The

very senior people I put on the last list tended not to be terribly

involved in politics or policy, or in the case of some Asian Americans,

had already served in the Clinton and even Carter Administrations and so I

thought we should seek new talent. But theres no magic to some of the

placements. I think the lists are fairly exhaustive, but some of the

people may be moved to other categories.

 

3) High-profile Muslim Americans tend to be the subject of a fair amount

of blogger criticism, and so the individuals on this list would need to be

ESPECIALLY carefully vetted. I suspect some of the people I list would

not survive such a vet  but I do personally know, at least in part,

virtually all of the candidates in the 1st two categories (but I know very

few of those listed for outside boards/commissions).

 

4) I listed the elected Muslim American democratic officials at the end

of the second category, but for various reasons, I didnt think any of

them would necessarily be suitable for an Administration appointment.

Nevertheless, I wanted to flag them for you in case you wanted to evaluate

them further.",1
"58","83.txt","Pro-Cruz Robocall Warns Nevada Voters of Impending Missile Strike","CARSON CITY, Nv.  A robocall dialed out to hundreds of thousands of conservative voters on Tuesday warned of an imminent missile strike on several cities in Nevada, including the state capital, Carson City. The call prompted a mass evacuation of potential Republican supporters from the state and has been blamed for at least twenty-five deaths.

Just hours before the start of Nevadas Republican caucus, potential voters received a forty-five second prerecorded phone call informing them that New York, Washington, and Los Angeles had just been obliterated by ballistic missiles. Evacuation orders have been issued for your state, the call calmly explained. You are to immediately report to your precincts designated polling center for further instructions.

The vast majority of those who received Tuesday afternoons robocall -perhaps out of fear of nuclear annihilation- didnt stay on the line long enough to find out that the call had been paid for by Ted Cruz for President and, according to the Texas senators campaign manager, was meant to merely warn voters of the dangers of a Trump presidency.

In an interview with MSNBCs Chuck Todd, Senator Cruz said that such calls are common during primary season and accused his fellow candidates of forming a behind-the-scenes alliance in order to conduct a dishonest and misleading smear campaign against him. The senator expressed sadness over the tragic loss of at least two-dozen potential voters who perished trying to flee a fictitious Nevadan Hiroshima but blamed his rivals for taking parts of the call out of context in order to discredit him at the expense of the good people of Nevada.

Meanwhile, statements released by the Trump and Rubio camps called for a complete redo of the Nevada caucus. While Senator Rubio accused Cruz of denying people their constitutional rights; Donald Trump complained that Cruzs deceptive tactics had likely cost him millions of votes.

The Nevada caucus marks the final GOP primary leading up to Super Tuesday on March 1st.",1
"59","84.txt","Special Report: Obamas Bathroom Breaks Cost Taxpayers $4.1 Billion in 2015","WASHINGTON, D.C.  According to a new report scheduled for public release this week by the Government Accountability Office, President Obamas bathroom breaks may have cost U.S. taxpayers just over $4 billion in 2015. Data provided to the GAO by the Obama administration shows that on average, President Barack Obama took 3.5 bathroom breaks a day last year, with each trip to the toilet lasting four minutes or less.

By the GAOs estimate, the commander-in-chief spent just over eighty-five hours in the bathroom in 2015 alone. The question on everyones mind when they look at a report like this is, What exactly is he doing in there?' Wondered Republican senator John McCain. The former POW admitted to C-SPAN that he goes to the bathroom about once a day on a good day.

Even so, the Arizona senator cited a particularly disturbing quote from the report stating that on October 23rd, the day former secretary of state Hillary Clinton was scheduled to testify before the House Select Committee on Benghazi, President Obama took a record-breaking twenty-one minute bathroom break. I think its very telling, Senator McCain said.

The average adult male uses the restroom anywhere from three times a day to once every three days, said Dr. Deepak Gupta, a senior scatologist at Johns Hopkins Medical Center in Baltimore. Ideally we see about one ounce of stool per every twelve pounds of body weight, Dr. Gupta explained, continuing, With that said, President Obama -who weighs about one hundred eighty pounds, should produce about fifteen ounces of solid fecal matter per bowel movement.

However, Dr. Gupta pointed out that due to unusually high levels of stress associated with the job of running the country, President Obama likely produces well below average stools. In all probability, the guy is a stool softener addict, Dr. Gupta told Real News Right Now.

Despite President Obamas low performance rating in the bathroom, the GAO estimates he still uses an above-average amount of toilet paper and -if hes a courtesy flusher, as White House Press Secretary Josh Earnest once hinted, he uses at least twice as much water per visit to the mens room as the average American. This, coupled with the obvious breaks in productivity, has cost taxpayers a whopping $4.1 billion.

This is simply unacceptable, Florida senator and GOP presidential candidate Marco Rubio told Real News Right Now. This is the kind of imprudent overzealous spending that I intend to do away with. Senator Rubio said he and other Republican congressmen -in an effort to save taxpayers a buck or two, often wear adult diapers while on Capitol Hill. Its uncomfortable but from a moral standpoint, its the right thing to do. We as elected officials owe that much to our constituents.",1
"60","85.txt","ISIS Leadership Among Top GOP Campaign Contributors","WASHINGTON, D.C.  Abu Bakr al-Baghdadi and other members of the Islamic States leadership council have provided more than five million dollars in campaign contributions to Republican presidential candidates this year, according to a campaign finance report released by the Republican National Committee last week.

According to the report, more than half of the GOPs leading presidential contenders including Senators Ted Cruz and Rand Paul, have received upwards of one million dollars from the Islamic State. However, specific standards set in place by the Federal Election Committee limit individual donors to a maximum contribution of $2,700 per year. In addition, the FEC strictly prohibits foreign nationals from making any sort of contribution toward elections held in the United States.

To the delight of the RNC, the Islamic State has found a convenient loophole to bypass these restrictions. Using the same global financial networks already in place meant to provide funding to its various terror operations, ISIS is able to funnel cash through a number of waypoints before it reaches sympathetic Americans residing in the United States. Then, using funds provided by the Islamic State, individuals simply write a check for the maximum donation allowed, payable to a presidential candidates campaign.

Its really an ingenious system, said James Arevalo, assistant campaign manager for Senator Ted Cruz. Obviously the senator doesnt see eye to eye with the Islamic State on some issues, Arevalo told CNN, continuing, That said, we certainly share very similar beliefs and values with ISIS, particularly when it comes to womens rights and gun control. Arevalo added that candidates have a moral obligation to meet the uphold the values of supporters and donors alike.

In the wake of the nations most recent mass shooting that left fourteen people dead and another twenty-two injured in San Bernardino, California, the Republican party, at the request of the Islamic State and the National Rifle Association, once again blocked legislation that would enact stricter gun control policies in the United States.

Currently there are an estimated 700,000 people on the U.S. governments terror watch list with several thousand residing in the United States. Legislation proposed by Democratic Senator Dianne Feinstein would have prevented terror suspects, felons, and individuals with a history of mental illness from purchasing firearms.

House Speaker Paul Ryan, who opposed the legislation, told CBS This Morning that the act of blocking suspected terrorists and convicted felons from legally obtaining firearms would infringe upon the rights of law-abiding citizens.",1
"61","86.txt","President Obama, Jon Stewart to Moderate Fifth GOP Debate","NEW YORK, Ny.  During a Democratic fundraiser in New York last Monday, President Barack Obama announced he has signed a contract with CNN to co-moderate the fifth GOP debate with former Daily Show host Jon Stewart. Set for December 15th in Las Vegas, Nevada, the debate is tentatively focused on foreign policy.

They need a little touch of reality, the president said, receiving a wide applause from the audience. This isnt an audition for the babysitters club, its the Oval Office. In the past, President Obama has publicly questioned whether or not the current Republican presidential hopefuls possess the intellectual and moral fortitude required to run the country.


Presidential debates shouldnt be centered around catering to the candidates comfort level, said CNN political analyst Melissa Cunningham, referring to the most recent CNBC debate which prompted a failed attempt by the GOP to harness control of future debates. Cunningham continued, Itll be interesting to see how they field questions from a seasoned politician, particularly one that knows the ins and outs of the job theyre vying for.

Meanwhile, former Vice Presidential nominee and reality TV star Sarah Palin railed against the Obama administration for once again trying to sandbag the Republican party and suggested the president might be better suited leading a morning call to prayer.

Former Daily Show host Jon Stewart, who many speculate will play good cop to President Obamas bad cop during the debate, visited the White House this week to brainstorm possible debate questions with the president. Im told the meeting was very constructive, White House Press Secretary Josh Earnest told reporters Tuesday afternoon.

Fox News will host the fourth installment of the Republican presidential debates on November 10th in Milwaukee. Subsequently, the fifth GOP debate, featuring President Obama and Jon Stewart, is scheduled to air December 15th at 6 p.m. PST on CNN. The event will be held at The Venetian in Las Vegas.",1
"62","87.txt","Top Black Lives Matter Activist: We Will Incite Riots Everywhere if Trump Wins","Dear white peopleniggas such as myself are fully hell bent on inciting riots everywhere we go

UPDATE: Poe deleted his tweet and then claimed that he never made the comments. The tweet is archived here and a screenshot of it appears below.

Hes now whining about slander. Talk crap, then play the victim when you get challenged on your crap. Same process EVERY time with social justice warriors.

Prominent Black Lives Matter activist and rapper Tef Poe has a message for white people: If Donald Trump wins the presidency, niggas will incite riots everywhere.

Dear white people if Trump wins young niggas such as myself are fully hell bent on inciting riots everywhere we go. Just so you know, Poe tweeted today.

He followed up with another promise: Trump wins aint no more rules fammo. Weve been too nice as is.

Poe is by no means a nobody, he has appeared in innumerable articles charting the rise of Black Lives Matter and was credited with coining the phrase, This aint your grandparents civil rights movement.

The rapper was one of the co-founders of Hands Up United, a social justice organization that emerged after the death of Michael Brown that was responsible for coordinating large BLM protests in the St. Louis area.

St. Louis was hit by riots in August last year as police were forced to use tear gas to disperse demonstrators who threw bricks and bottles at officers.

The hands up, dont shoot! mantra was later discredited by DNA and autopsy evidence that confirmed Michael Brown did not have his hands up when he was shot by Officer Darren Wilson.

Poes threat to incite riots comes on the same day as it emerged that some of the radical groups involved in shutting down Donald Trumps rally in Chicago last week are planning a mass civil disobedience movement beginning next month.

Donald Trump himself also warned that any attempt by the GOP establishment to steal the nomination from him may result in civil unrest.

I think you would have riots. I think you would have riots, Trump told CNNs Chris Cuomo this morning. I think you would see problems like youve never seen before. I think bad things would happen. I really do.

Trump was quickly blasted by many sectors of the media for invoking the prospect of riots, a sentiment that wasnt seen immediately after the riots in Ferguson, Missouri, when publications like Time Magazine argued that rioting was a justifiable form of protest.",1
"63","88.txt","BOOM! The House Just Voted 383-0 In Support of Christians Obama Isnt Happy About This","The Obama administration refuses to even utter the words radical Islamic terrorism, so its no surprise that they have refused to call the murders of Christians by ISIS genocide, but thats exactly what it is. ISIS is literally trying to totally eliminate entire populations of people who do not believe the way they do.

When the House votes 383-0 against Obama, you know there is something majorly wrong with the mentality of the White House.

From Fox News:

The House approved a resolution Monday that declares the Islamic State is committing genocide against Christians and other religious minorities in the Middle East  putting even more pressure on the Obama administration to do the same ahead of a deadline later this week.

The resolution passed the House with a unanimous vote of 383-0.

The resolution came to a vote just days after the release of a graphic new report by the Knights of Columbus and In Defense of Christians on ISIS atrocities. The report made the case that the terror campaign against Christians and other minorities in Syria, Iraq and other parts of the Middle East is, in fact, genocide.

When ISIS systematically targets Christians, Yezidis, and other ethnic and religious minorities for extermination, this is not only a grave injusticeit is a threat to civilization itself, Rep. Jeff Fortenberry, R-Neb., said in a statement. We must call the violence by its proper name: genocide.

The resolution was voted on ahead of a congressionally mandated March 17 deadline for Secretary of State John Kerry and the White House to make a decision on whether to make such a declaration. The measure is an effort to force the administrations hand on the issue, as the administration has so far declined to take an official position.

There is a similar measure in the Senate that has yet to be voted on.

Obama may want to protect Islam and disregard Christians, but it is abundantly clear there are hundreds of leaders in the House and Senate who do not agree with Obamas notions.

If the resolution passes the Senate at a similar margin as the house, it will solidify the level of embarrassment our country feels toward Obama.",1
"64","89.txt","URGENT: The Mainstream Media Was Hiding One HUGE Fact About Trump Win!","Yall are gonna get a REAL kick outta this one. So remember how the Mainstream Media wouldnt shut up about Hillary Clinton beating Donald Trump in the popular vote by 2.8 Million? Well, that is technically true, but they left out one MAJOR fact

IF YOU DISCOUNT CALIFORNIA AND NEW YORK, DONALD TRUMP BEAT HILLARY CLINTON BY MORE THAN 3 MILLION VOTES IN THE OTHER STATES!!



You see, Hillary Clinton managed to win the classic blue states (both of which have massive sanctuary cities) by 4.2 million in California and 1.8 million in New York.

In fact, by those numbers, it is safe to say that California alone is the ENTIRE reason Clinton won the popular vote and California does NOT speak for the entire country.

This is exactly why the electoral college exists, though. These 2 states do not account for the entire nation. They know NOTHING about the problems in places like Michigan, Minnesota, Ohio, and Florida, all of which voted Trump. (H/T  Daily Mail)

Newt Gingrich brilliantly stated,

THIS IS FOOTBALL SEASON. A TEAM CAN HAVE MORE YARDS AND LOSE THE GAME. WHAT MATTERS IS HOW MANY POINTS YOU PUT ON THE BOARD.



So it looks like the brilliant system set up by our founding fathers worked out just the way it was supposed to.

Im sure a bunch of crybabies will still try and say he didnt win, but if they do, just look them in the eye and say Welcome to America, B*TCH! This is what Freedom Tastes Like",1
"65","9.txt","BREAKING: Washington Post Just Caught Red Handed in MASSIVE Fake News Scandal!!","This is really one of those funny, beautiful moments in history when a big, old, and unreliable news source like the Washington Post gets caught red handed in their own web of lies.

You see, just last week the Washington Post published an article in which they claimed to have an actual list of news companies that work for Vladimir Putin. Well, surprise, surprise, that all turned out to be a big old load of CRAP!

Today the Post was forced to add new notes to that article which essentially read that their list was crap and the source they claimed was reliable is actually just a bunch of Liberal morons.


Screenshot of editors note admitting that Washington Post published an unverified Fake News list.
Their source was an anonymous website called PropOrNot which said they had a obtained a list of people directly employed by Russia or idiots that repeat Russian Propaganda.

The beautiful irony is that the only website dumb enough to actually believe their list was the Washington Post. Do you know why? Because they are nothing but scam artists.

Let me break this down plain and simple for you folks. WaPo and other old news sources lost all of their Trust when they lied about the election this year. Of course, the problem goes even further back to when they LIED about Nukes being in Iraq.



Now, these big papers are losing money and scared of becoming irrelevant. They are trying to freak out the public with all sorts of lies about their competitors just to save their own asses. SHAME ON THEM! (H/T  Daily Mail)

Trump is luckily fighting back, but its important that regular folks like you and I do our best to get this information shared everywhere so we can end the reign of the LYING mainstream media once-and-for-all!!",1
