"","id","headline","text","type"
"137","186.txt","Clinton FBI Director Backs Trump's Attorney General Pick Jeff Sessions, Defends His Records on Civil Rights","The campaign to rally support for Donald Trumps pick to head the Justice Department is growing, with former FBI Director Louis Freeh, who served under President Bill Clinton, now joining the effort.

In a letter to the Senate Judiciary Committee, Freeh offered his strong recommendation that Senators confirm their colleague Jeff Sessions, R-Ala., as the next attorney general, defending his record on civil rights, which has become a key concern for critics.

I have known Jeff since 1989 when we worked together as prosecutors on one of the most important civil rights cases investigated and prosecuted by the United States Department of Justice, Freeh wrote. [I] have always been greatly impressed with his commitment to the rule of law, his fair and balanced prosecutorial judgment, and his personal dedication to protecting civil rights.

What Jeff Sessions Has Said About Race and Civil Rights
After Sessions was announced as Trumps pick for attorney general, top Democrats and some civil rights groups expressed concern over decades-old allegations that he made racist remarks when he was U.S. Attorney in Alabama. Others alleged -- under oath during his 1986 confirmation hearings for a federal judgeship -- that he once called a white civil rights lawyer a disgrace to his race and dubbed some efforts by the National Association for the Advancement of Colored People ""un-American.""

During the hearings, one lawyer who worked with Sessions claimed the lawmaker told him he thought the KKK was ""OK until I found out they smoked pot."" Sessions said the comment was a joke but apologized.

Under oath himself, Sessions also insisted he harbored no racial bias and said the allegations were either false or being taken out of context. He was nevertheless blocked from becoming a judge.

In his letter on Tuesday, Freeh pointed to Sessions work on the 1989 murders of a federal judge in Alabama and an NAACP official in Georgia.

I was struck with Jeffs fierce determination to solve these civil rights murders, which so gravely impacted the rule of law and the guarantee of civil rights in America, Freeh wrote, noting that, Jeff and his office were key decision-makers in formulating and implementing the investigative strategy which ultimately led to the arrest and conviction of Walter Moody for these murders.

Meanwhile, a conservative judicial organization, the Judicial Crisis Network, has created an entire website devoted to pushing Sessions' confirmation.

He is a world-class legal mind and a tough but fair lawyer with invaluable experience, says the website, ConfirmSessions.com. Known for his deep respect for the Constitution and adherence to the rule of law, Sen. Sessions has worked tirelessly to defend the civil rights and legal rights of all Americans.

Democratic Party leaders, meanwhile, have called Sessions nomination deeply troubling.

Over the course of his career, Senator Sessions used the power of the courts to discriminate against civil rights leaders, allegedly used racially charged language to disparage minorities, expressed support for the KKK and then tried to dismiss it as a joke, celebrated the gutting of the Voting Rights Act, opposed same-sex marriage, denied the constitutionality of Roe v. Wade, voted against greater access to healthcare for veterans, blocked the Paycheck Fairness Act, and voted against the reauthorization of the Violence Against Women Act,"" Democratic National Committee Interim Chair Donna Brazile said in a statement last month.

Freeh, who served as FBI director from 1993 to June 2001, expressed no such concerns, calling Sessions a friend who has had a distinguished career in public service.

I believe that Jeff will be an outstanding Attorney General for the Nation, Freeh said.",2
"138","187.txt","Trump sons distance themselves from fundraiser","After reports that Donald Trumps adult sons were listed as directors for a nonprofit offering inauguration weekend access to the president-elect, the Trump campaign pushed back on claims of their involvement in the organization. 

The Center for Public Integrity reviewed filing documents for the Opening Day Foundation, a Texas nonprofit formed on Dec. 14 that says its dedicated to preserving the great outdoors. In a draft invitiation to the event, billed as Opening Day 2017, donors giving at least $500,000 to the nonprofit were promised a private reception and photo opportunity with Mr. Trump as well as a multi-day hunting and/or fishing excursion with Donald Trump Jr. and Eric Trump.

 Donald Trump's wealthy group of Cabinet picks
Play VIDEO
Donald Trump's wealthy group of Cabinet picks
Opening Day is your opportunity to play a significant role as our family commemorates the inauguration of our father, friend and President Donald J. Trump. Join us as we celebrate the great American tradition of outdoor sporting, shooting, fishing and conservation, reads a draft of the invitation, first obtained by TMZ. The draft invitation also listed Mr. Trumps two adult sons as honorary co-chairmen of the event.

But Tuesday afternoon, Trump transition spokeswoman Hope Hicks denied the involvement of Mr. Trumps sons. 

The Opening Day event and details that have been reported are merely initial concepts that have not been approved or pursued by the Trump family, said Hicks in a statement. Donald Trump Jr. and Eric Trump are avid outdoorsmen and supporters of conservation efforts, which align with the goals of this event, however they are not involved in any capacity. 

In a call with reporters Wednesday, the transition team repeated that the Trump sons would have no involvement with the event itself. 

According to the New York Times, the event is still scheduled, but references to the hunting trip have been removed. 

The Camouflage & Cufflinks-themed evening will still be held at a convention center in Washington, D.C. on January 21, the day following Mr. Trumps inauguration to the White House.

Ivanka Trump takes fire for hawking $10,800 bracelet worn on 60 Minutes
Two of the four directors of the Opening Day Foundation, Dallas hedge fund manager Gentry Beach and Tom Hicks Jr., the son of a Texas billionaire, were fundraisers for the Trump campaign and are close to Donald Trump Jr, according to local news reports. But soon after the Center for Public Integrity found that the Opening Day Foundations nonprofit registration papers also listed Donald Trump Jr. and Eric Trump as directors of the organization, a spokeswoman for the president-elect released a statement disavowing the participation of the Trumps.

A spokeswoman for the Texas secretary of state told the Washington Post Wednesday that new paperwork had been filed to remove the Trump sons from the Opening Day Foundation leadership.",2
"139","188.txt","Walmart pulls 'Black Lives Matter' shirts from website after cop complaints","Walmart removed several varieties of shirts and hoodies with the slogan Bulletproof: Black Lives Matter from its website, a spokesperson confirmed Wednesday, after a police union complained they were offensive.

Like other online retailers, we have a marketplace with millions of items offered by third parties that includes Blue Lives Matter, Black Lives Matter and All Lives Matter merchandise, said a spokesperson for the worlds largest retailer, with more than $482 billion in revenue. After hearing concerns from customers, we are removing the specific item with the bulletproof reference.

The head of the Fraternal Order of Police wrote an open letter to Walmart Tuesday night requesting that the company to take down Black Lives Matter merchandise from its website. 

Canterbury wrote that the clothing would damage your companys good name amongst FOP members and other active and retired law enforcement officers. The FOP calls itself the worlds largest law enforcement group, claiming more than 330,000 members in 2,200 lodges.

At a time of year when we as a nation and indeed, as a world, should be coming together in hopes of peace on Earth and goodwill toward men, these third party sellers are profiting from racial division, he added.

The right-wing website Breitbart drew attention to the presence of Black Lives Matter shirts on Walmarts site earlier this month, which prompted some on Twitter to call for a boycott of the retailer. 

Like many retailers doing business online, Walmart offers merchandise from third-party sellers on its website, which can be distinguished by a small note on the product page.

As of Wednesday afternoon, shirts with the Bulletproof slogan could not be found on Walmarts website. Plenty of other merchandise with phrases like Black Lives Matter, Blue Lives Matter, All Lives Matter and even Journalists Lives Matter was available at $18 to $42 apiece.",2
"140","189.txt","Report: Trump team questions costs of State Department's environment efforts","Donald Trumps transition team is asking State Department officials to reveal how much of their funding goes towards international environmental groups, according to a new Washington Post report. 

The query, posed in a list of questions to the State Departments Bureau of Oceans and International Environmental and Scientific Affairs, asked, How much does the Department of State contribute annually to international environmental organizations in which the department participates?

State Department spokesperson John Kirby noted Wednesday, however, that there is nothing out of hte norm regarding questions being asked by the transition team. 

The questions, Kirby told reporters, were very much aligned with their need to better understand the bureaucracy and organization that theyre about to lead. 

Nothing falls outside the normal inquiries, Kirby said. 

Despite State Department assurances, the inquiry has increased worries that the president-elects transition team is prioritizing a rollback of the Obama administrations actions on climate change and conservation efforts. 

While Mr. Trump has met with prominent climate change activists since his election victory, the president-elect has also tapped several people to lead government agencies that have agendas contrary to Mr. Obamas own climate and renewable fuel focus. For instance, Oklahoma Attorney General Scott Pruitt -- who Mr. Trump has chosen to lead the Environmental Protection Agency -- is a vocal denier of climate change science and has even sued the Obama administration over its clean power plant rules. Mr. Trumps pick for secretary of state, oil magnate Rex Tillerson, has said climate change could pose significant risks, but there is little indication that the Exxon Mobil executive will prioritze the issue. 

Mr. Trump also threatened during his campaign to scuttle the United States involvement in the landmark Paris climate change accord, an international agreement to limit greenhouse gas emissions and try to reverse global warming effects. The Paris treaty holds the U.S. accountable for donating $3 billion over four years to the Green Climate Fund, which is devoted to helping poorer countries weather the detrimental effects of climate change.

Similarly, the Energy Department was also recently sent a questionnaire to divulge the names of employees who had worked on climate change policies. The department said it would not be complying with that request, and the Trump transition team disavowed the original questionnaire, saying it was not authorized.

The Trump transition team did not immediately respond to a request for comment confirming the Post report.

According to the White Houses Office of Management and Budget, of the State Departments 2016 budget of $30.91 billion, about $128 million was allocated for natural resources and the environment.  ",2
"141","190.txt","North Carolina legislators to reconsider transgender bathroom bill","RALEIGH, N.C.  Legislators who passed the North Carolina law known as the bathroom bill nine months ago head back to the capital on Wednesday to consider repealing it. But theres uncertainty over exactly what lawmakers will do, in part because this Republican-controlled legislature has shown a willingness to go its own way, despite intense outside pressure to scrap the law.

Legislators returned to Raleigh for a special session called by GOP Gov. Pat McCrory to eliminate House Bill 2 -- the bathroom bill -- which has been blasted by gay-rights groups and resulted in job losses and sporting event cancellations. 

No repeal bill backed by Republicans had been made public by midday. Instead, House Republicans returned to a closed-door meeting Wednesday morning that continued into the afternoon. They held a similar meeting that lasted for more than four hours Tuesday night. Some Republicans were unhappy after learning that Charlotte on Monday had not repealed its entire nondiscrimination ordinance, which had been the genesis of HB2, Republican repeal supporter Rep. Chuck McGrady said. 

On a difficult issue where the parties dont have a lot of trust, we got thrown a curveball by the less than full repeal by Charlotte, McGrady tweeted early Wednesday. 

The fact that McCrory called lawmakers back to Raleigh a month before their 2017 sessions start was challenged by an opponent of HB2s repeal. 

There is no extraordinary circumstance, said Rep. Jeff Collins, R-Nash, during a brief debate over session procedures, other than the extraordinary hubris of a city council telling us we have to act by a certain date. Mondays action by the Charlotte council was contingent on HB2s repeal by Dec. 31.  

Over the past year, there has been bitter fighting between Democrats and Republicans. Just last week, Republican leaders convened a surprise legislative session and passed two laws designed to bring Democratic Gov.-elect Roy Coopers powers in check when he becomes governor Jan. 1.

Cooper blasted McCrory over House Bill 2 during the governors race, and the fallout over the law  job losses, canceled concerts and sporting events  contributed to McCrorys narrow defeat. The wide-ranging law is best known for requiring transgender people to use restrooms corresponding to the sex on their birth certificate in many public buildings.

GOP Rep. Chuck McGrady of Hendersonville supports repealing the entire law and said he believes a significant number of House members from both parties do as well.

Everybody is acting in good faith in my opinion, McGrady said. House Republicans met by phone Monday and would meet in person in Raleigh later Tuesday, he said.

However, lawmakers were already under pressure from some conservative groups to keep HB2 in place.

Were sending the message to our supporters that lawmakers should not now betray people who supported them and compromise common-sense principles like privacy, dignity and freedom from our citizens, said Tami Fitzgerald, executive director of the North Carolina Values Coalition.

House Speaker Tim Moore and Senate leader Phil Berger have only issued a brief statement Monday, saying they would take up the repeal of HB2. They also criticized Cooper for taking too much credit.

They did not return messages for comment Tuesday.

Charlotte appears to have held up its end of the bargain, but the measure enacted Monday notes that its dependent on HB2 being repealed in its entirety by Dec. 31. That could give some lawmakers justification not to repeal it.

Cooper, who helped broker Charlottes cooperation with phone calls over the weekend, expects a full repeal, his spokeswoman Megan Jacobs said late Monday.

The law also limits statewide protections for LGBT people in public accommodation and employment, and it reinforced a prohibition on local governments from raising minimum wage. Local governments are also prevented from enacting nondiscrimination measures that would go further than state law.

The session is scheduled several days before Christmas, with some legislators out of town.

GOP Rep. Jeff Collins of Rocky Mount, who voted for HB2 in March, told The Wilson Times that he was not interested in repealing anything. I think we did the right thing the first time, he told the newspaper.

Passing a repeal would only require a handful of GOP support  perhaps 10 in the Senate or 15 in the House  if all Democrats voted for it.

Discussions about repealing the law increased after decisions by the NCAA and Atlantic Coast Conference to move their championship events out of North Carolina this academic year. The NBA also moved an All-Star Game out of Charlotte.

Democratic Rep. Grier Martin of Raleigh said until theres a full repeal, Im pretty certain that were not going to see another NBA All-Star Game or NCAA tournament game in North Carolina.

LGBT advocates said they were cautiously hopeful.

We are holding out hope that the legislators will keep their word, said Simone Bell, Southern Regional Director for the LGBT-rights group Lambda Legal. We want complete and full repeal of HB 2.",2
"142","191.txt","After violence abroad, Trump meeting with security adviser","PALM BEACH, Fla. -- President-elect Donald Trump is planning to meet with his incoming national security adviser in the aftermath of a rattling day of violence around the world.

Trump appeared to jump ahead of investigators in blaming Islamic terrorists for deadly incidents Monday in Turkey and Germany and vowing anew to eradicate their regional and global networks. He called the brazen shooting of Russias ambassador to Turkey a violation of all rules of civilized order. He added that a radical Islamic terrorist had assassinated the diplomat, Andrei Karlov.

Turkish authorities identified the gunman as Mevlut Mert Altintas, a member of Ankaras riot police squad, and said he was later killed in a shootout with police. Altintas shouted in Turkish about the Syrian city of Aleppo and also yelled Allahu akbar, Arabic for God is great.

President-elect Trump describes mission to fight terrorism
As for Berlin, where at least 12 people were killed and nearly 50 hurt when a truck plowed through a Christmas market, Trump said the Islamic State group and other Islamist terrorists continually slaughter Christians in their communities and places of worship as part of their global jihad. A man held by German authorities after the violence was later released after a lack of evidence to connect him to the incident.

Trumps meeting scheduled Wednesday with retired Lt. Gen. Michael Flynn will come a day after Flynn and several other members of the incoming national security team met with Vice President-elect Mike Pence in Washington. Aides said the meeting was planned before the acts of violence, though they were discussed.

The gathering with Pence included retired Gen. John Kelly, Trumps nominee for head of the Department of Homeland Security; retired Gen. James Mattis, the pick for defense secretary; and Rex Tillerson, the head of Exxon Mobil and the intended nominee for secretary of state.

While Trump has assembled his Cabinet at a quick pace, the process to fill out top White House jobs has been slowed by infighting among advisers. Some of Trumps earliest advisers have expressed concern to the president-elect himself that they are getting boxed out in favor of those more closely aligned with incoming chief of staff Reince Priebus, who has chaired the Republican National Committee.

Among those whose future is still in flux is Corey Lewandowski, Trumps controversial first campaign manager who was fired after clashing with the president-elects family. On Monday, Lewandowski met with Jared Kushner, Trumps influential son-in-law, and could still be offered a job in the administration, though potentially one that would keep him out of the West Wing - and away from the president.

The president-elects transition team has said it expects to announce some White House positions in the coming days.

Former FBI agent on how Berlin terror attack differs from Nice
Trump met Tuesday with candidates for his unfilled Cabinet positions, including prospective hires to run the Department of Veterans Affairs, a beleaguered agency that the Republican businessman has vowed to overhaul.

At Mar-a-Lago, Trumps palatial Florida estate, the president-elect met with Luis Quinonez, who runs a company with military and health care ties and is said to be under consideration for VA secretary. He also interviewed Toby Cosgrove, the CEO of the Cleveland Clinic, who was a top contender to replace Eric Shinseki when he resigned from the VA in 2014. Cosgrove later withdrew from consideration.

Trump repeatedly pledged during the campaign to fix the woes at the department and said he would take care of great veterans. But he also came under scrutiny for being slow in paying out money raised for veterans groups and for suggesting that strong veterans dont need treatment for mental health problems.

Others said to be considered for the post include former Massachusetts Sen. Scott Brown, Florida Rep. Jeff Miller and Pete Hegseth, an Army veteran and former CEO of Concerned Veterans for America.

Trump is also considering Jovita Carranza, who worked in President George W. Bushs administration, as his choice for U.S. trade representative. She served as deputy administrator of the Small Business Administration under Bush.

With just a handful of Cabinet posts to fill, Trump is facing some criticism for a lack of diversity in his senior team, which currently includes no Hispanics. The National Association of Latino Elected and Appointed Officials said Tuesday that it was deeply concerned at the lack of Hispanics considered for top jobs. Carranza was a member of Trumps Hispanic advisory council during the campaign.

Pence, meanwhile, met in Washington with former Texas state official Susan Combs, who served both as state agriculture commissioner and comptroller. Trump also needs to fill the Agriculture Department slot. Transition officials did not immediately confirm if Combs is up for that post.",2
"143","192.txt","Which candidates did the seven ""faithless"" electors support?","A historic number of faithless electors -- seven in total--each cast their ballots on Monday for a candidate other than the one who won his or her state. What may be more surprising, given the level of protests against Donald Trump and the pressure exerted on Republican electors, is that a greater number were untrue to Hillary Clinton than to Mr. Trump.

Among the 538 electors chosen to represent their states in the Electoral College, five were faithless to the Democratic nominee and two to the Republican. Prior to this year, there hasnt been more than one faithless elector in any presidential election since 1948.

What is next for the Electoral College?
Among the Democratic faithless electors was David Mulinix, of Hawaii, who cast his vote for Bernie Sanders instead of Hillary Clinton. He said he believes the Electoral College is outdated, according to Hawaii News Now, which also pointed out that though Hawaii forbids faithless electors, Mulinixs vote still counted and he would face no punishment because Hawaii has never bothered to come up with a penalty for breaking the law.

Four of the faithless electors came from Washington, a state won by Clinton. Three of them--Bret Chiafalo, 19-year-old Levi Guerra, and Esther John-- cast their votes for former Secretary of State Colin Powell, according to the Seattle Times. They also participated in a movement started by Chiafalo. The so-called Hamilton Electors base their ideology on Alexander Hamilton--one of the Founding Fathers who wrote about the Electoral College in the Federalist Papers.  

The fourth faithless elector, Robert Satiacum, voted for Faith Spotted Eagle--a woman who is a member of the Yankton Sioux Nation, according to a local NBC affiliate. She played a public role in opposing the Keystone XL and Dakota Access pipelines.

President-elect Trump lost Texas elector Christopher Suprun to John Kasich. Another Texas elector, Bill Greene, voted for Libertarian Ron Paul, according to the Texas Monthly. 

Though there is no Constitutional provision or federal law barring electors from voting for whom they are pledged, more than half of the states, including D.C., bind their electors. The rest of electors may have the legal authority to vote for whomever they want, but, as CBS News previously reported, faithless electors have never decided a presidential election.

The entire procedure lasted well into the evening, with the official tally coming in around 8 p.m--though the president-elect clinched the nomination with the necessary 270 votes earlier in the evening. According to a final tally, Trump received 304 votes compared to Clintons 227.

The votes cast Monday will be sent on to the nations capital by late December. Subsequently, on Jan. 6, Vice President Joe Biden will open the electoral votes before a joint session of the new Congress, where they will be counted one last time.",2
