"","id","headline","text","type"
"1","001.txt","How Obama Used The DOJ To Destroy A Reporters Life And Blanket Full Immunity Over Clinton","A quick trip down memory lane causes a stumble over this gem from Obama. He was gearing up for his first run at the office of President and was spewing lies all over the American public.



Ill make our government open and transparent so that anyone can ensure that our business is the peoples business.

He is finally living up to that with less than a month left to his Presidency. He is not bothering to hide the dirty business he conducts, because he just doesnt care anymore. Recent months aside, everything that Obama pledged regarding transparency was smoke and mirrors.

Many are speculating that he will step up and stop talking about the Hillary email scandal and simply pardon her from any prosecution. It is in his best interest to do so. His attempts to marginalize the issue by nitpicking the statutory categories of confidential, secret and top secret by commenting that theres classified and then theres classified were not successful. He then took up the Clinton rhetoric of Russian spies. Since emails from the President to the unsecure Clinton email were found, it is likely that he will try and end the scandal while he still has the power to do so.

A reporter with first-hand knowledge sums up Obamas transparent government, Obama and his team criminalized reporting, becoming the most secretive White House since Richard Nixon.

A message on the White House website from Obama makes it clear he still maintains the illusion that his office upheld the pledge of transparency;

My Administration is committed to creating an unprecedented level of openness in Government.  We will work together to ensure the public trust and establish a system of transparency, public participation, and collaboration. Openness will strengthen our democracy and promote efficiency and effectiveness in Government.

Every action taken by Barack Hussein Obama was calculated. He knew, as did his advisors and supporters, that he was actively engaged in deception against the United States. David Axelrod was the Chief Strategist for both of Obamas campaigns. He also served as Senior Adviser to the President until 2011.

He was positioned to not only witness the secrecy that Obama demanded but he was also part of it. After leaving the Obama administration, Axelrod began to hint that things were quite different if we only looked below the surface.

Some of his revelations regarding Obama continue to come as a shock to people who the President painted with the colors of truth.

Obama lied about his support FOR same-sex marriage before announcing his support for it in 2012. Yet if Obamas views were evolving publicly, they were fully evolved behind closed doors, Axelrod writes. The president was champing at the bit to announce his support for the right of gay and lesbian couples to wed.
Obama chewed out Maureen Dowd on the campaign plane during the 2008 campaign. No one got under Baracks skin more than Maureen  He was patronizing and disrespectful. This is a direct contradiction to the calm, composed, Obama that Axelrod had helped to portray. He even lashed out at Axelrod.
Obama can have a short fuse, though he hides it from the public: The president called Axelrod a motherr and stalked out of a meeting after his strategist criticized the presidents debating techniques as Obama prepared for his 2012 debate with Republican nominee Mitt Romney says Axelrod.
While those incidents speak to Obamas two-faced behavior, some of the secrecy of his administration can be summed up as simply lies;

Lie: Obama has told the world there has never been a better friend of Israel in the White House.

Truth: In September 2012, an Israeli newspaper reported that senior Obama Administration officials have told Tehran that Barack Obama does not intend to join Israel in any attack on Irans nuclear installations.

Lie: In May 2011, Obama said the fence between America and Mexico was basically complete.

Truth: The Department of Homeland Security admits just 36.3 miles or 5% of the border is fenced.

Lie: Obama lied and said abortions would not be publicly funded under Obamacare.

Truth: A March 2012 edict from the Department of Health and Human Services (HHS) unequivocally ruled Obamacare will use our tax dollars to fund abortion.

Ben Rhodes was Obamas partner in crime when it comes to one of the biggest lies of the administration; the Iran nuclear treaty. Rhodes, Obamas Deputy National Security Adviser, openly admitted his contempt for journalists, All these newspapers used to have foreign bureaus. Now they dont. They call us to explain to them whats happening in Moscow and Cairo. Most of the outlets are reporting on world events from Washington. The average reporter we talk to is 27 years old, and their only reporting experience consists of being around political campaigns. Thats a sea change. They literally know nothing.

He later admitted more to David Samuels, a writer profiling Rhodes for a New York Times Magazine cover story; In the spring of last year, legions of arms-control experts began popping up at think tanks and on social media, and then became key sources for hundreds of often-clueless reporters. We created an echo chamber. They were saying things that validated what we had given them to say. Rhodes was obviously not ashamed to display his contempt.

Fast forward to the present day and the new level of corruption that Obama reached when dealing with journalist James Rosen. In 2006, Risen published State of War: The Secret History of the CIA and the Bush Administration. Unsurprisingly, President Bush did not take kindly to the book and his administration turned the whole situation into an investigation of government whistleblowers.

Risen was subpoenaed to reveal his sources, something he vehemently refused to do. He speaks about the attempt by Presidents to try and spin these stories; Well, they have gone after investigative reporting. They try to take, essentially, stories that they dont like, and try to find some classified information that might be part of that, and then turn it into a criminal leak investigation in which they say someone mishandled or disclosed classified information. As you know, you could do that with virtually any story in Washington.

Since then Risen has fought the Bush administration and then the Obama administration. In 2009, Obama took a rather unprecedented step of renewing a subpoena scheduled to expire that year. He was probably hoping nobody remembered that when in 2014 speech he told reporters; Here, in the United States of America, police should not be bullying or arresting journalists who are just trying to do their jobs and report to the American people on what they see on the ground.

In 2010, despite Risen keeping his sources confidential, the federal government indicted Jeffrey A. Sterling, a former CIA operative, with leaking the classified information to Risen. He continued his defiance, facing jail time, when the government ordered him to appear as a witness at the trial of Sterling.

Finally in January of 2015, after 7 years of uncertainty, the government decided not to call Risen in the trial. His fight for the truth had finally won.

Risen is a good example of how the Obama administration has fought the very ideas that he promised to uphold. It is very likely that we will see more insiders coming forward to open up about Obamas years in the White House. The truth would be a refreshing change.

A supporter of Risen, Jerry Kammer, a former Pulitzer Prize-winning reporter who now works at the Center for Immigration Studies, has this to say about President Obama;

He promised to be a different kind of president. But he has only suppressed efforts to disclose the governments misdeeds. His administration has been untransparent at so many levels.",1
"2","002.txt","BREAKING  Trump DEFIES Obama, Tells Americans What Obama is Doing Behind the Scenes","Donald Trump was promised a smooth and respectful transition by President Barack Obama, but its been anything but. Obamas massive ego and thin skin now has him publicly degrading Trumps landslide Electoral College victory and diligently working behind the scenes to thwart the will of the people.

Barack Obama sat in the Oval Office with Donald Trump about one month ago and vowed to do his best to foster a peaceful transition of power and to carry out the desire of the American people. Those lofty sentiments turned snarky quickly when it came time for Obama to start packing up his belongings and vacate the peoples house.

 Follow
 Donald J. Trump ? @realDonaldTrump
Doing my best to disregard the many inflammatory President O statements and roadblocks.Thought it was going to be a smooth transition - NOT!
9:07 AM - 28 Dec 2016
  16,738 16,738 Retweets   53,680 53,680 likes
Over the course of the past month, Obama added a record number of new regulations across a myriad of federal agencies that try to control our lives  and livelihoods. In the past few days, he surpassed his own record and likely isnt done trying to curtail President-Elect Trumps authority after he is sworn in as the 45th president of the United States.

Obama instructed his ambassador to the United Nations to abstain from a vote which drastically impacted one of our most staunch allies, Israel. A veto by the United States, which has been done in the past, would have prevented the U.N. Security Council from attempting to create a two-state solution between Israel and the Palestinians by demanding that settlement building in disputed areas cease immediately.

Very quietly, Obama also welcomed more than 2,000 new Muslim refugees onto American soil. These people, largely men, already had their asylum requests denied by the Australian government. They were being held in a detention facility when Obama decided the American taxpayers should begin paying for their resettlement  regardless of the risks to national security.

President Obama had heralded George W. Bushs commitment to a respectful transition and promised his distraught staff would adhere to the same level of professionalism and decorum. Instead, he led the charge to behave like a petulant spoiled child himself.

First, Michelle Obama sat down for a chat with Oprah Winfrey and claimed America is now without hope. Tens of millions of Americans are feeling hopeful for the first time in eight years, but those of us who live in flyover country or are part of blue collar communities or the middle class really dont matter to liberals.

Lashing out at Donald Trump because We the People chose him over a corrupt, lying career politician simply showcases how shallow and self-involved Barack Obama and his wife truly are. There is nothing Democrats in Congress can do to stop Trumps agenda from passingthanks to Harry Reids short-sighted pushing for the nuclear option.

Michael Moore and his horde of liberal followers will not be able to stop Trump from being sworn in on January 20  nor will they succeed in pushing his oath-taking ceremony inside. The efforts of #Disrupt20 protesters will fail just as surely as Jill Steins recount endeavors.

If Barack Obama wanted his legacy to involve appearing small, glib, and completely delusional, he has succeeded. He is now nothing more than a frustrating nuisance for President-Elect Donald Trump and the patriotic Americans who cast ballots in his favor. Soon Obama will finally be gone, and Trump can repeal his foolish liberal regulations and executive orders and put the nation back on the track to greatness and prosperity for ALL!",1
"3","003.txt","Turkeys Erdogan Says U.S. Supports ISIL: We Have Evidence With Pictures & Videos","Turkeys President Recep Erdogan has come out swinging today. With the U.S. led coalition (Britain and France included) recently suffering an embarrassing defeat in Aleppo, Syria when Iranian and Russian forces helped to liberate the city from ISIL, this latest incident could be seen as Turkey throwing salt on the U.S. wound. 

Erdogans bombshell statements highlighted what most of the world is now coming to accept as reality:

They [the U.S.] give support to terrorist groups including Daesh (IS/ISIL). We have confirmed evidence, with pictures, photos and videos.

While no videos or pictures have been made public yet, the world can only hope that Erdogan and company can make good on his words by publicly disclosing their alleged evidence.

Adding to the disclosure was Irans Defense Minister Hossein Dehghan:

The Western coalition is of a formal nature, they have no real intention to fight neither in Syria nor in Iraq. We dont see any readiness on their part to play a truly useful and meaningful role in fighting IS, because its them who have raised terrorists and they are interested in keeping them there. Maybe the coalition forces would like to see terrorists weakened, but certainly not destroyed, because those terrorists are their tool for destabilizing this region and some other parts of the world.

Of course, this statement is no longer just a theory or speculation, as U.S. House Representative from Hawaii, Tulsi Gabbard has introduced a bill that would stop the U.S. government from funding and supporting ISIL, both directly and indirectly. Tulsi stated a few things sure to get the attention of many:

If you or I gave money, weapons or support to al-Qaeda or ISIS, we would be thrown in jail. Why does our gov get a free pass on this? The CIA has also been funneling weapons and money through Saudi Arabia, Turkey, Qatar and others who provide direct and indirect support to groups like ISIS and al-Qaeda. This madness must end. We must stop arming terrorists. The Government must end this hypocrisy and abide by the same laws that apply to its citizens. 

What is most interesting about Erdogans comments today then is the fact that he is calling out the U.S. government for funding and arming ISIL and other terrorists groups, when he has also been called out for doing the same. Remember from the paragraph above that Tulsi Gabbard said Turkey is one of the countries arming and funding ISIL. We must also remember when Vladimir Putin said the same thing in November of 2015.

So, perhaps Turkey (or certain aspects within the military and intelligence community within Turkey) have stopped coordinating with the CIA and other intelligence groups in helping to aid ISIL. Putin and Erdogan have made it no secret as to their willingness to collaborate more over the past several months. One of the biggest signals of this growing collaboration between Russia and Turkey was the signing of the Turkish Stream pipeline in late October. Additionally, Moscow announced today that they will be intensifying cooperation between Turkey, Iran and themselves within Syria. Maybe, just maybe, Turkey has broken ties with the Western banking/political cabal. Time will tell. 

It would make sense though in many ways if Turkey has broken off all or most ties with the Western cabal, as the world sees the writing on the wall for ISIL: Time is short.

Not only was ISIL defeated in Aleppo (the biggest battle to date), but they are being defeated in Mosul, Iraq. Today, Iraqs Prime Minister Haider al-Abadi told the world that ISIL would be defeated in Iraq within three months. 

Perhaps Turkey has made a full pivot East and is now working to defeat the terrorist group they were once arming and funding. Stranger things have happened. We watch in great anticipation as to what will happen next. ",1
"4","004.txt","Egyptian paper: Transcript proves Kerry plotted UN resolution against Israel with Palestinians  Report","On Tuesday, the Times of Israel reported that an Egyptian newspaper published what it called transcripts of meetings between top US officials  including Secretary of State John Kerry  and Palestinian officials that could, if true, prove Israels accusations that the Obama regime was behind the anti-Israel UN resolution approved by the Security Council.

According to the Times of Israel:

At the same time, a report in an Israeli daily Tuesday night pointed to Britain helping draft the resolution and high drama in the hours leading up to the vote, as Jerusalem tried to convince New Zealand to bury the Security Council measure.

In a meeting in early December with top Palestinian negotiator Saeb Erekat, US Secretary of State John Kerry told the Palestinians that the US was prepared to cooperate with the Palestinians at the Security council, Israels Channel 1 TV said, quoting the Egyptian Al-Youm Al-Sabea newspaper.

Also present at the meeting were US National Security Adviser Susan Rice, and Majed Faraj, director of the Palestinian Authoritys General Intelligence Service.

Kerry is quoted as saying that he could present his ideas for a final status solution if the Palestinians pledge they will support the proposed framework. The US officials advised the Palestinians to travel to Riyadh to present the plan to Saudi leaders.

According to the Times, the Egyptian report fits Israeli claims that it has ironclad proof the Obama regime helped craft the anti-settlement resolution.

We have ironclad information that emanates from sources in the Arab world and that shows the Obama administration helped craft this resolution and pushed hard for its eventual passage, said David Keyes, spokesman for Prime Minister Benjamin Netanyahu.

Additionally, the Guardian said Israel may provide this information to the incoming Trump administration:

Doubling down on the claim a few hours later the controversial Israeli ambassador to Washington, Ron Dermer, went even further suggesting it had gathered evidence that it would present to the incoming Trump administration.

We will present this evidence to the new administration through the appropriate channels. If they want to share it with the American people, they are welcome to do it, Dermer told CNN.

According to Dermer, not only did the US not stand by Israels side during the vote, it was behind this ganging up on Israel at the UN.

Jeff Dunetz noted:

Israel fears that Kerry lays out his comprehensive vision for two-state solution and then turns it into another Security Council resolution imposing additional anti-Israel settlement terms on Israel, or at upcoming peace conference in Paris on Jan. 15 that Israel is not attending, all before the Israel-hating Obama leaves the White House three weeks from this coming Friday. Another possibility is the US recognizing a Palestinian State, any of the above eliminates the possibility of a negotiated solution.

The Egyptian report did not detail whose transcripts of the meeting it had obtained or how it had obtained them.

At the end of the meeting, the report said,  Rice and Kerry requested that the content of the discussion remain secret because of the sensitivity of the matter during the transition period in the U.S. The same way Kerry kept negotiations for the Iran deal secret from Israel until it was too late.

The Obama regime, however, has denied allegations that it was behind the resolution.

We did not draft this resolution; we did not introduce this resolution. We made this decision when it came up for a vote, Obama deputy national security adviser Ben Rhodes said Friday.",1
"5","005.txt","Obamas Racist Attacks Against White Working Class Caused Historic Democrat Party Collapse","Since 2008 Obama and Democrats lost white working class voters across the US.

Middle class voters are Republican Trump voters.
Obama just sealed the deal with his anti-white racism.

The map below shows how Obama lost working class white voters in every state since taking office except for Vermont and Massachusetts.



New York Times

Democrats may have lost the white working class vote for generations.
Its Obamas fault.

And just this week Barack Obama was out again railing against white working class Americans for his partys woes.
iPatriot reported:

Obama also blamed Rush Limbaugh, Fox News, and the NRA for distracting the country from his message of hope and change, particularly during the holiday season.

If were not actually out there changing the narrative like we are during campaigns, then folks in a lot of these communities, what theyre hearing is Obama wants to take away my guns, he said.  Obama is disrespecting my culture and is primarily concerned with coastal elites and minorities. Ah yes, the problem was you couldnt mindlessly brainwash the country Barack, not that your message was fundamentally anti-American.

Obama defended the robbers and hosted Black Lives Matter in the White House.

The Black Lives matter led to several police deaths, lootings and burned businesses.
Law-abiding white and black Americans have had enough.

Obama will be missed when he leaves the White House
By the criminals and thugs.",1
"6","006.txt","urkey President Claims Has Video Evidence Obama Is Supporting ISIS","President Recep Tayyip Erdogan of Turkey is once again making accusations that the United States is directly supporting ISIS. Hes been mixed up in rumors of his supposed profiteering from the illicit ISIS oil trade in the past, so his accusations carry with them a need for healthy skepticism. Still, he is adamant in his allegations and says hes got irrefutable evidence.

His claims go beyond the single step of removal from direct involvement, our maintaining the implausible plausible deniability of aiding the so-called freedom fighters or rebels, the insulation the US has relied upon in arming, training and financing Obamas terrorist allies in the past. Its more than an acknowledgment of the rebranding of ISIS terrorists, our supposed enemy, as anonymous factions under the White House subversive.

Its beyond the contention of the Russians or the photographic evidence that John McCain was foolish enough to provide, what is basically little more than a choice in headscarf colors, the difference between their equivalent of the crips and the bloods, as being the legitimizing factor for aiding our terrorist enemies as the non-existent moderate freedom fighters.

Erdogan said in his Tuesday comments that he has confirmed evidence that US-led forces have supported ISIS. Erdogan stated in no uncertain terms that its very clear the US is supporting ISIS. He said, They were accusing us of supporting Daesh (ISIS). Now they give support to terrorist groups including Daesh, YPG, PYD. Its very clear. We have confirmed evidence, with pictures, photos and videos. YPG and PYD are Kurdish groups that Erdogan regards as terrorists operating against Turkey.

Flanked by the visiting Guinean President Alpha Conde, Erdogan said, The coalition forces are unfortunately not keeping their promises. Whether they do or they dont, we will continue along this path in a determined way. There is no going back on the path we have set out on.

Erdogan complained They are supporting all the terror groups  the YPG, PYD but also including Daesh (ISIS)  Its quite clear, perfectly obvious, he said, adding that Turkey could provide proof in pictures and video. During a November visit to Pakistan Erdogan made similar claims, alleging the West stands by Daesh (ISIS) right now and its weapons were Western-made. At the time he declined to provide his evidence for inspection.

He needs to be more forthcoming this time around. If hes got the evidence, show it. Certainly none of us would be surprised to learn that Obama is behind ISIS, its already well known. We would like to put our hands on his proof, though, in order to properly charge Obama and convict him.",1
