"","id","headline","text","type"
"102","137.txt","New push to replace Obamacare reignites old GOP tensions","Republicans on Capitol Hill are already laying the groundwork for a rapid repeal of President Obamas signature health-care law beginning on the first day of the new Congress, before President-elect Donald Trump is even sworn in.

But the urgent efforts to make good on a Republican campaign promise six years in the making obscure major GOP divisions over what exactly to replace Obamacare with and how to go about it, and how long a transition period to allow before the laws insurance would go away.

Hard-liners are pushing to move as fast as possible, bolstered by a GOP base eager to see lawmakers follow through on years of promises. But key congressional leaders are keenly concerned about potentially throwing millions off their insurance plans and repeating what they have long decried as Democratic missteps eight years ago, sparking a fierce political backlash by moving too far, too fast.

While Trump could sign legislation gutting the Affordable Care Act before the spring bloom, a full replacement could take months, if not years.

Id like to do it tomorrow, but reality is another matter sometimes, said Sen. Orrin G. Hatch (R-Utah), chairman of the Senate Finance Committee that will help lead the repeal and replace efforts. We have to live with the real world. And the real world right now is that the Democrats wont help with anything.
S
Donald Trump has campaigned to repeal and replace the Affordable Care Act, otherwise known as Obamacare, once he gets into office. Now that he's won the presidency with a majority Republican House and Senate, that feat might not prove to be too easy. Wonkblog's Max Ehrenfreund explains. (Daron Taylor/The Washington Post)
Hatch and other high-ranking Republican senators are pushing for an extended transition period that could keep large portions of Obamacare in effect until 2019 or beyond, allowing time to carefully craft a replacement and push the final debate past the midterm elections.

Many of them, like Sen. Susan Collins (R-Maine), have been chastened by conversations with insurers and state regulators who are warning of chaos in the market for individual insurance if Congress moves rashly.

I dont want to leave the 84,000 people in Maine who are buying insurance on the exchange uninsured because, all of a sudden, two-thirds of them who have subsidies have lost that subsidy, Collins said.

But those Republicans are clashing with GOP colleagues  many of them sent to Congress in the midterm, anti-Obama waves of 2010 and 2014  who see little reason to dawdle.

The history of this place is, the longer it takes, the more exponentially the probability grows that itll never get done, said Rep. Mark Meadows (R-N.C.), elected recently as the new chairman of the hard-right House Freedom Caucus. Republicans have been saying they have a replacement plan for over two years, so why do we need three years?

Part of the problem is that Republicans have never been able to agree on a replacement plan, despite railing against Obamacare for nearly eight years now. Their foot-dragging is a function of internal divisions and the political peril of floating a detailed alternative that would be closely evaluated for costs and benefits. Trump has also been vague, promising a terrific replacement that will provide great health care at a fraction of the cost.

The current battle centers on when exactly to schedule Obamacares sunset. But other fights loom  over what precisely a replacement plan should look like, whether Obamacares Medicaid expansion will continue, whether lawmakers should also now tackle the future of Medicare, and how Congress should assist insurers during the transition.

 Senate Majority Leader Mitch McConnell (R-Ky.) has announced plans to put an Obamacare repeal on the Senate floor on Jan. 3. (Jonathan Ernst/Reuters)
The battle lines, however, are familiar, with establishment Republicans on one side and conservative insurgents, mainly in the House, on the other. Those dynamics pushed GOP leaders into increasingly dramatic confrontations with President Obama and last year helped force House Speaker John A. Boehner (R-Ohio) to retire.

Come Jan. 20, Obama will no longer serve as a foil for Republicans, and while Senate Democrats could block parts of a health-care overhaul, the real fight will occur inside the GOP.

Senate Majority Leader Mitch McConnell (R-Ky.) has announced plans to put an Obamacare repeal on the Senate floor come Jan. 3. But that will only set the stage for a future repeal bill that will have to tackle major decisions such as a sunset date and interim measures to stabilize insurance markets.

So far, Trump and key GOP leaders on Capitol Hill have shied away from taking firm positions on repeal and replace, but they have done little to tamp down the expectations of conservatives expecting a swift and wholesale substitute.

Were going to repeal Obamacare lock, stock and barrel, Vice President-elect Mike Pence told donors to the conservative Heritage Foundation recently. The number one priority of this administration is to keep that promise to the American people.

Hard-liners on Capitol Hill see Pence and Rep. Tom Price (R-Ga.), Trumps pick for health and human services secretary, as allies in their push for quick and decisive action. Pence called on Congress to pass a repeal bill with all deliberate speed but pledged only to then set into motion a process to replace it.

House Speaker Paul D. Ryan (R-Wis.) said Thursday that Republicans would move as well and as fast as we can but make sure that the transition does not pull the rug out from under people.

Transition spokesman Sean Spicer said Friday that Obamacare replacement strategy has been part of discussions Trump and Pence are having with top congressional leaders and that the talks are ongoing.

The idea is to really figure out the sequencing on both the repeal and the replace, he said.

Conservative activists who pushed a take-no-prisoners approach toward the Obama administration say their patience is limited.

When Republicans have the House, the Senate and the White House, you dont wait, said Adam Brandon, president and chief executive of FreedomWorks, a conservative advocacy group. Im a Cleveland Indians fan. I only get a shot at a World Series every couple decades. When you have a shot to do it, you do it. Thats it.

Democrats and many health-care experts are warning that a swift repeal could lead insurers to stop selling policies to individuals on federally mandated exchanges. More than 12 million Americans are covered under those policies.

Health and Human Services Secretary Sylvia Mathews Burwell briefed Senate Democrats on Thursday on the expected unraveling of Obamacares insurance exchanges, according to people familiar with her remarks inside the closed-door meeting.

Delayed replacement is a situation where it is basically repeal and chaos in terms of what will ensue, because of the uncertainty that will get presented to insurers, providers, consumers and states, Burwell told reporters after the meeting.

Republicans want to end Obamacares system of penalties and subsidies. But many  including Trump  want to continue to ban insurers from denying coverage or sharply increasing rates for the sick.

Experts warn that repeal and delay under those conditions would prompt insurers to flee the individual market. Linda J. Blumberg, a senior fellow at the Urban Institute, said insurers could face as much as $3 billion in losses if healthy individuals leave the market once the subsidies and penalties are eliminated.

That $3 billion is the tip of the iceberg, Blumberg said. With all of these changes and the uncertainty, it is hard to predict how bad the risk is going to get.

Keeping insurers in the market during the transition could require Congress to step in with bailout payments, something that would be deeply unpopular among conservative lawmakers.

The insurance industry should understand that theres a new sheriff in town, said Rep. Ken Buck (R-Colo.), a Freedom Caucus member. They signed up for Obamacare, and if they want to make a profit, theyre going to have to figure out how to make a profit in a free-market insurance industry.

The strategy of repealing Obamacare without first replacing it reflects not only the wishes of the GOP base, but also Senate arithmetic.

There will be a slim 52-to-48 Republican majority come January, and while Republicans can gut Obamacare with a simple majority using arcane budget rules, passing a complete replacement will require 60 votes.

Only by dismantling Obamacare first, Republicans say, will they have a chance to persuade enough Democrats to support a replacement plan  and Democrats have already signaled that they will not do so.

We all know we have to repeal it to get them to even settle down and work with us at all, Hatch said.

Incoming Senate Democratic leader Charles E. Schumer (D-N.Y.), however, has rejected that strategy. Were not going to do a replacement. If they repeal without a replacement, they will own it, he told The Washington Post recently.

But the Republican base, prodded by conservative media outlets and well-organized activist groups, has been loath to accept Democratic obstruction as an excuse for inaction.

One prominent activist, Jenny Beth Martin, co-founder of the Tea Party Patriots, suggested that Trump could goose the repeal-and-replace efforts by reversing an administrative ruling that gave financial assistance to 11,000 congressional members and staff who were forced onto the Obamacare exchanges under a compromise included in the original law.

I dont think anyone thinks that youre going to flip a switch .?.?. but the replacement for it needs to happen quickly, she said. We want it done as quickly as it possibly can be done.

Brandon was even blunter: This is going to be a hard thing for Republicans, but tough [cookies], he said. Theyre going to have to push this through using parliamentary maneuvers, and guess what? Its hard.

The political risk in doing nothing is why you got Donald Trump in the first place, he added. The old excuses of having divided government, theyre gone.

A few strident Obamacare critics are urging activists to soften a bit. They have to look at the complexity of the problem here, and hopefully theyll recognize that its not quite so simple, said Sen. Ron Johnson (R-Wis.), who was first elected in the 2010 tea party wave.

But many others are not.

Literally every Republican member has made this part of their platform in running for Congress, said Rep. Mark Walker (R-N.C.), a first-termer who will chair the conservative Republican Study Committee next year. Weve got to act on it.",2
"103","138.txt","Key GOP senators join call for bipartisan Russia election probe, even as their leaders remain mum","Two Senate Republicans joined demands for a bipartisan probe into Russias suspected election interference allegedly designed to bolster Donald Trump as questions continue to mount about the president-elects expected decision to nominate a secretary of state candidate with close ties to Russia.

Sens. Lindsey O. Graham (R-S.C.) and John McCain (R-Ariz.)  the chairman of the Senate Armed Services Committee  joined calls by incoming Senate Democratic leader Charles E. Schumer (N.Y.) and Armed Services ranking Democrat Jack Reed (R.I.) for a thorough, bipartisan investigation of Russian influence in the U.S. elections. Their statement came two days after The Washington Post reported the CIAs private conclusion that Russias activities were intended to tip the scales to help Trump.

Recent reports of Russian interference in our election should alarm every American, the four senators said in a statement on Sunday morning. Democrats and Republicans must work together, and across the jurisdictional lines of the Congress, to examine these recent incidents thoroughly and devise comprehensive solutions to deter and defend against further cyberattacks.

This cannot become a partisan issue. The stakes are too high for our country. We are committed to working in this bipartisan manner, and we will seek to unify our colleagues around the goal of investigating and stopping the grave threats that cyberattacks conducted by foreign governments pose to our national security, they added.

 
Republican senators John McCain (Arizona) and Lindsey Graham (South Carolina) have been highly have been highly critical of Donald Trumps comments about Russia. (Michael Reynolds/EPA)

But McCain and Graham  who frequently criticized Trump before and after his election  have often bucked Republican leaders, and their embrace of a wide-ranging Russia probe does not necessarily signal support from other Republicans, including Senate Majority Leader Mitch McConnell (R-Ky.).
Sen. Susan Collins (Maine), one of the more moderate Republicans in the upper chamber, suggested a bipartisan investigation may be useful toward achieving an objective accounting of any alleged meddling by foreign adversaries.

The purpose of any investigation, whether by the Obama administration or Congress, is not to question or relitigate the results of any past or present Presidential election, she said in a statement. Instead, any review must focus on the long overdue task of improving the defenses of the United States against cyber attacks, including those that might seek to affect or influence political campaign.

Another GOP senator  Sen. James Lankford (Okla.), who serves on the Senate Intelligence Committee  agreed with McCain and Grahams decision to support a bipartisan investigation of suspected cyber intrusion by Russia in the U.S. elections.

Cybersecurity investigation of Russian interference cant be partisan, Lankford tweeted Sunday.

Meanwhile, the Senate Intelligence Committees chairman, Richard Burr (R-N.C.), said Sunday that the panel will continue to conduct vigorous oversight of all intelligence matters.

But he made no specific mention of Russia, unlike Sen. Ron Johnson (R-Wis.) said cyber threats by Americas rivals, including Russia, pose serious challenges that should not be politicized or viewed through a partisan lens.

Johnson said as chairman Senate Homeland Security and Governmental Affairs Committee and a member of the Senate Foreign Relations panel he would continue to hold hearings based on fact  not innuendo  for the sole purpose of informing effective policy and appropriate countermeasures.

Republicans may be loath to join calls for such a wide-ranging investigation into Russias election-related activities given that Trump has dismissed the CIA claims as ridiculous. They may worry about picking an obvious fight with the president-elect before he is even inaugurated. Trump has signaled he wants a warmer relationship with Russian President Vladimir Putin, whom he praised during the campaign.

I think its just another excuse. I dont believe it .?.?. No, I dont believe it at all, Trump said of the CIA charges on Fox News Sunday. Trump campaign manager Kellyanne Conway echoed her boss on CBSs Face the Nation, saying that such allegations from the intelligence community were laughable and ridiculous.

Trump also played down the importance of receiving the daily intelligence briefing, a tradition for presidents and presidents-elect. He has received the briefings only sporadically since winning the election.

A U.S. intelligence official said it is concerning that intelligence on Russia relating to the election is being dismissed out of hand as false or politically partisan.

The inclination to ignore such intelligence and impugn the integrity of U.S. intelligence officials is contrary to all that is sacred to national security professionals who work day and night to protect this country, said the official, who spoke on the condition of anonymity because of the sensitivity of the issue.

Trump denies CIA's assessment that Russia tried to help him win election  Play Video2:37
CIA officials told senators it is now quite clear that electing Donald Trump was Russias goal. In an interview on Fox News Sunday on Dec. 11, President-elect Trump denied the CIA's assessment. (Victoria Walker/The Washington Post)
[Trump denies CIA report that Russia intervened to help him win election]

McConnell himself has been notably silent since the Post report was published on Friday night, and his number-two, Senate Majority Whip John Cornyn (R-Texas), downplayed the significance of it in a series of tweets  although some of them suggested Congresss review of Russian actions should broaden.

All this news of Russian hacking: it has been going on for years. Serious, but hardly news, Cornyn tweeted Saturday.

The Texas Republican seemed to support, however, a wider look at Russia as a global actor rather than one confined to its role in the U.S. election, retweeting the below tweet from Graham: Cyber-attacks, undermining NATO, Ukraine, butchery in Syria, etc. I intend to look at all things Russia  not just election influence.

Meanwhile, House Speaker Paul D. Ryan (R-Wis.), in his first substantial comment on Russian hacking since the report Friday, said Sunday he rejects any politicization of intelligence matters, calling foreign intervention unacceptable.

For the most part, other key Republicans were silent on the issue of whether to embrace a bipartisan look at whether  Putins government was behind the hacks of the Democratic National Committee emails and their publication by WikiLeaks in an alleged bid to help Trump and damage Hillary Clintons campaign.

At the same time, several Republican senators raised concerns about Trumps likely nomination of Rex Tillerson, ExxonMobils chief executive, as secretary of state due to his  ties to Putin. Republicans in a 52-to-48 Senate have only the slimmest of margins to get him confirmed, should Democrats decide to uniformly oppose the nomination. Only three Republicans would need to side with Democrats in order to defeat Tillerson.

The potential nomination sparked a backlash among the partys traditional hawks who oppose Putin, and some senior strategists feared that more than a handful of Republicans would outright oppose his nomination  requiring Trump to find Democratic support in order to confirm his potential Secretary of State.

Its a matter of concern to me that he has such a close relationship with Vladimir Putin, that that would color his approach to Vladimir Putin and the Russian threat, McCain told CBSs Face the Nation.

Being a friend of Vladimir is not an attribute I am hoping for from a Secretary of State, Sen. Marco Rubio (R-Fla.) tweeted Sunday.

Republicans outnumber Democrats by only one vote on the Senate Foreign Relations Committee, which must approve a secretary of state nominee before the full Senate votes. Over the weekend, several committee Democrats, including Sens. Robert Menendez (N.J.) and Christopher A. Coons (Del.), stated their deep skepticism of Tillerson as a candidate.

In a post on Facebook, Menendez called the idea Tillerson could be named secretary of state alarming and absurd, concluding that the Trump administration would be guaranteeing Russia has a willing accomplice in the Presidents Cabinet guiding our nations foreign policy.

Yet the committees chairman, Sen. Bob Corker (R-Tenn.)  who was considered a possible pick for Trumps secretary of state  has said Tillerson would be a good choice.

If it is Rex Tillerson, he is a very good individual, Corker tweeted.

Should Tillerson make it to a floor vote, Democrats could not block the nomination alone. If Democrats stick together, Republicans must muster at least 50 of the 52 votes they will have to successfully confirm him, as Vice President-elect Mike Pence could cast the tiebreaking vote.

Graham has already also strongly hinted that he might oppose the nomination.

I dont know the man much at all, but lets put it this way: If you received an award from the Kremlin, order of friendship, then were gonna have some talkin, Graham said early Saturday morning. Well have some questions. I dont want to prejudge the guy but thats a bit unnerving.",2
"104","139.txt","Trump says nobody really knows if climate change is real","President-elect Donald Trump said Sunday that nobody really knows whether climate change is real and that he is studying whether the United States should withdraw from the global warming agreement struck in Paris a year ago.

In an interview with Fox News Sunday host Chris Wallace, Trump said hes very open-minded on whether climate change is underway but has serious concerns about how President Obamas efforts to cut carbon emissions have undercut Americas global competitiveness.

Im still open-minded. Nobody really knows, Trump said. Look, Im somebody that gets it, and nobody really knows. Its not something thats so hard and fast. I do know this: Other countries are eating our lunch.

There is a broad scientific consensus that human activity  including the burning of fossil fuels for transportation, heating and industrial manufacturing  is driving recent climate change. In its most recent report, the Intergovernmental Panel on Climate Change concluded that it is extremely likely that, since the 1950s, humans and their greenhouse gas emissions have been the dominant cause of the planets warming trend. The top 10 hottest years on record have all been since 1998, and 2016 is expected to be the hottest year since formal record-keeping began in 1880.

But its not the first time that Trump has disregarded that established scientific view.

During the presidential campaign, Trump referred to climate change as a hoax perpetrated by the Chinese, a comment he later described as a joke. But during a town hall in New Hampshire, he also mocked the idea of global warming. At that event, Meghan Andrade, a volunteer for the League of Conservation Voters, asked Trump what he would do to address the issue, to which he replied: Let me ask you this  take it easy, fellas  how many people here believe in global warming? Do you believe in global warming?

After asking three times Who believes in global warming? and soliciting a show of hands, Trump concluded that nobody believed climate change was underway except for Andrade.

During Sundays interview with Wallace, Trump said he needed to balance any environmental regulation against the fact that manufacturers and other businesses in China and elsewhere are able to operate without the kind of restrictions faced by their U.S. competitors.

If you look at what  I could name country after country. You look at whats happening in Mexico, where our people are just  plants are being built, and they dont wait 10 years to get an approval to build a plant, okay? he said. They build it like the following day or the following week. We cant let all of these permits that take forever to get stop our jobs.

The U.S. has outpaced the rest of the developed world in terms of growth since the 2008 recession, though developing countries such as China boast higher growth rates. Typically, economists compare the U.S. against other industrialized nations since developing countries typically grow faster than their developed counterparts.

The New York businessman made the same critique of the Environmental Protection Agency, to which he has nominated Oklahoma Attorney General Scott Pruitt  a climate change skeptic  as the head. Wallace asked whether he was going to take a wrecking ball to the Obama legacy, to which Trump replied, No. No. No. I dont want to do that at all.  I just want whats right.

EPA, you cant get things approved. I mean, people are waiting in line for 15 years before they get rejected, okay?  he said. Thats why people dont want to invest in this country.

It is unclear which permit application Trump was referring to, but he has repeatedly criticized EPA rules. And though he has given mixed signals on whether he would back out of the United States voluntary commitments under the Paris climate agreement, it would take several years for the next administration to withdraw now that the agreement has entered into force.


Last week Trumps transition team for the Energy Department asked officials there to identify which employees have participated in international climate negotiations or worked on domestic efforts to cut greenhouse gases, such as calculating the social cost of carbon. Several scientists, federal union officials and public watchdog groups have expressed concern that these individuals could be targeted for retaliation once Trump takes office.

Trump transition team for Energy Department seeks names of employees involved in climate meetings  Play Video1:54
The Trump transition team has issued a list of 74 questions for the Energy Department, asking officials there to identify which department employees and contractors have worked on forging an international climate pact as well as domestic efforts to cut the nation's carbon output. (Whitney Shefte/The Washington Post)
At the urging of daughter Ivanka, Trump has met in the past week with former vice president Al Gore and actor Leonardo DiCaprio, both environmental activists. Trump described the sessions as good meetings but did not elaborate.",2
